[
  {
    "slug": "accounting-office",
    "office_name": "ACCOUNTING OFFICE",
    "address": "3rd Flr.",
    "trunkline": ["(02) 8284 4756"],
    "website": null,
    "email": [
      "accounting@taytayrizal.gov.ph",
      "tmg.accountingoffice@lgutaytayrizal.com.ph"
    ],
    "department_head": {
      "name": "Ms. Maria Fenina M. Gil, CPA, MPA",
      "contact": null,
      "email": null
    }
  },
  {
    "slug": "administration-office",
    "office_name": "ADMINISTRATION OFFICE",
    "address": "4th Flr.",
    "trunkline": ["(02) 8284 4780", "(02) 8284 4781"],
    "website": null,
    "email": ["administrator@taytayrizal.gov.ph"],
    "department_head": {
      "name": "Atty. Aldrick Daven M. Mendoza, MPA",
      "contact": null,
      "email": null
    }
  },
  {
    "slug": "agriculture-office",
    "office_name": "AGRICULTURE OFFICE",
    "address": "NTPM Road",
    "trunkline": ["8 700 144 98"],
    "website": null,
    "email": ["agriculture@taytayrizal.gov.ph"],
    "department_head": {
      "name": "Dr. Ramsen S. Andres, DVM",
      "contact": null,
      "email": null
    }
  },
  {
    "slug": "assessors-office",
    "office_name": "ASSESSOR'S OFFICE",
    "address": "2nd Flr.",
    "trunkline": ["(02) 8284 4708"],
    "website": null,
    "email": ["asessors@taytayrizal.gov.ph"],
    "department_head": {
      "name": "Interim Head: Atty. Aldrick Daven M. Mendoza, MPA",
      "contact": null,
      "email": null
    }
  },
  {
    "slug": "bids-and-awards-committee-bac",
    "office_name": "BIDS AND AWARDS COMMITTEE (BAC)",
    "address": "4th Flr.",
    "trunkline": ["(02) 8284 4787 (Engineering Office)"],
    "website": null,
    "email": [null],
    "department_head": {
      "name": "April Rose V. Bautista, JD, MBA",
      "contact": null,
      "email": null
    }
  },
  {
    "slug": "budget-office",
    "office_name": "BUDGET OFFICE",
    "address": "3rd Flr.",
    "trunkline": ["(02) 8284 4757", "(02) 8284 4772"],
    "website": null,
    "email": ["budget@taytayrizal.gov.ph"],
    "department_head": {
      "name": "Ms. Jastella M. Reyes, CPA",
      "contact": null,
      "email": null
    }
  },
  {
    "slug": "bureau-of-fire-protection-bfp",
    "office_name": "BUREAU OF FIRE PROTECTION (BFP)",
    "address": "3rd Flr. Manila East Arcade 2 Building (Beside Taytay Municipal Hall)",
    "trunkline": ["0917 148 9964"],
    "website": null,
    "email": ["taytayfirestation@yahoo.com"],
    "department_head": {
      "name": "Sr. Insp. Ronaldo P. Nalog",
      "contact": null,
      "email": null
    }
  },
  {
    "slug": "business-permit-and-licensing-office",
    "office_name": "BUSINESS PERMIT & LICENSING OFFICE",
    "address": "Ground Flr.",
    "trunkline": [
      "(02) 8284 4788 (Dept. Head)",
      "(02) 8286 6185",
      "(02) 8284 4789 (Staff)"
    ],
    "website": null,
    "email": ["bplo@taytayrizal.gov.ph", "kingdefante@gmail.com"],
    "department_head": {
      "name": "Atty. Joaquin J. Defante II, MPA",
      "contact": null,
      "email": null
    }
  },
  {
    "slug": "tourism-office",
    "office_name": "TOURISM OFFICE",
    "address": "4th Flr.",
    "trunkline": ["(02) 8284 4786"],
    "website": null,
    "email": ["tourism@taytayrizal.gov.ph", "tourism.lgutaytay@gmail.com"],
    "department_head": {
      "name": "Roel Villar Supendio, MBA",
      "contact": null,
      "email": null
    }
  },
  {
    "slug": "cctv-command-center",
    "office_name": "CCTV COMMAND CENTER",
    "address": "3rd Flr. (New Taytay Public Market)",
    "trunkline": ["(02) 8254 0431", "0985 488 3352"],
    "website": null,
    "email": [
      "cctvcommandcenter@taytayrizal.gov.ph",
      "tmdrrmo@taytayrizal.gov.ph"
    ],
    "department_head": {
      "name": "Mr. Paul Oliver Domingo",
      "contact": null,
      "email": null
    }
  },
  {
    "slug": "coa-auditors-office",
    "office_name": "COA - AUDITOR'S OFFICE",
    "address": "4th Flr.",
    "trunkline": ["(02) 8286 6145"],
    "website": null,
    "email": [null],
    "department_head": {
      "name": "Mr. Carla Gabrielle Eusebio",
      "contact": null,
      "email": null
    }
  },
  {
    "slug": "comelec-taytay-field-office",
    "office_name": "COMELEC - TAYTAY FIELD OFFICE",
    "address": "Manila East Arcade 2 Building (Beside Taytay Municipal Hall)",
    "trunkline": ["(02) 8284 4719"],
    "website": null,
    "email": ["comelectaytay@gmail.com"],
    "department_head": {
      "name": "Election Officer IV: Ms. Rhodora G. Aquino - Yanes",
      "contact": null,
      "email": null
    }
  },
  {
    "slug": "data-privacy-officer",
    "office_name": "DATA PRIVACY OFFICER",
    "address": "Legal Services Office (4th Flr.)",
    "trunkline": ["(02) 8 284 4774 (Legal Services Office)"],
    "website": null,
    "email": ["dataprotectionofficer@taytayrizal.gov.ph"],
    "department_head": {
      "name": null,
      "contact": null,
      "email": null
    }
  },
  {
    "slug": "dilg-taytay-field-office",
    "office_name": "DILG - TAYTAY FIELD OFFICE",
    "address": "4th Flr.",
    "trunkline": ["(02) 8284 4801"],
    "website": null,
    "email": ["dilg.foreigntravelauthority1@gmail.com", "taytaydilg@gmail.com"],
    "department_head": {
      "name": "Engr. Jennylynne Alvarez-Sicat, MPA",
      "contact": null,
      "email": null
    }
  },
  {
    "slug": "economic-enterprise-development-and-management-eedm-ntpm",
    "office_name": "ECONOMIC ENTERPRISE DEVELOPMENT AND MANAGEMENT (EEDM) - NTPM",
    "address": "NTPM",
    "trunkline": [
      "(02) 8 284 4715 (Treasury Office) (02) 8 640 5894",
      "0968 892 8690"
    ],
    "website": null,
    "email": ["ntpm.smile@gmail.com"],
    "department_head": {
      "name": "Mr. Helito A. Basco",
      "contact": null,
      "email": null
    }
  },
  {
    "slug": "engineering-flood-control-section",
    "office_name": "ENGINEERING - FLOOD CONTROL SECTION",
    "address": "NTPM",
    "trunkline": [null],
    "website": null,
    "email": [null],
    "department_head": {
      "name": "Mr. Vener Esguerra",
      "contact": null,
      "email": null
    }
  },
  {
    "slug": "engineering-office",
    "office_name": "ENGINEERING OFFICE",
    "address": "4th Flr.",
    "trunkline": ["(02) 8284 4787"],
    "website": null,
    "email": ["smiletaytayengineering@gmail.com"],
    "department_head": {
      "name": "Engr. Rodel Gatapia",
      "contact": null,
      "email": null
    }
  },
  {
    "slug": "engineering-office-taytay-public-cemetery",
    "office_name": "ENGINEERING OFFICE - TAYTAY PUBLIC CEMETERY",
    "address": null,
    "trunkline": [null],
    "website": null,
    "email": [null],
    "department_head": {
      "name": "Mr. Boycie Tagle",
      "contact": null,
      "email": null
    }
  },
  {
    "slug": "environment-and-natural-resources-office-menro",
    "office_name": "ENVIRONMENT & NATURAL RESOURCES OFFICE (MENRO)",
    "address": "Manila East Arcade 2 Building (Beside Taytay Municipal Hall)",
    "trunkline": ["(02) 8284 4794"],
    "website": null,
    "email": ["menro@taytayrizal.gov.ph"],
    "department_head": {
      "name": "Ms. Lyric Jo D. Dagandan",
      "contact": null,
      "email": null
    }
  },
  {
    "slug": "gender-and-development-office-gad",
    "office_name": "GENDER & DEVELOPMENT OFFICE (GAD)",
    "address": "3rd Flr.",
    "trunkline": ["(02) 8284 4778"],
    "website": null,
    "email": [
      "gad@taytayrizal.gov.ph",
      "genderanddevelopmenttaytay01@gmail.com"
    ],
    "department_head": {
      "name": "Ms. Ammilyn E. Naval",
      "contact": null,
      "email": null
    }
  },
  {
    "slug": "general-services-office-gso",
    "office_name": "GENERAL SERVICES OFFICE (GSO)",
    "address": "Ground Flr.",
    "trunkline": ["(02) 8286 4706", "(02) 8286 4783"],
    "website": null,
    "email": ["gsosmiletaytay@gmail.com", "gso@taytayrizal.gov.ph"],
    "department_head": {
      "name": "Mr. Emilio G. Solisa, MPA",
      "contact": null,
      "email": null
    }
  },
  {
    "slug": "gso-impounding-section",
    "office_name": "GSO - IMPOUNDING SECTION",
    "address": "4th Flr.",
    "trunkline": [null],
    "website": null,
    "email": [null],
    "department_head": {
      "name": "Ms. Agnes Lumogdang",
      "contact": null,
      "email": null
    }
  },
  {
    "slug": "gso-kalayaan-park-field-office",
    "office_name": "GSO - KALAYAAN PARK FIELD OFFICE",
    "address": "OTPM",
    "trunkline": ["0906 280 1778"],
    "website": null,
    "email": ["gsoofficetaytaybayan@gmail.com"],
    "department_head": {
      "name": "Mr. Dan Leycer Cruz",
      "contact": null,
      "email": null
    }
  },
  {
    "slug": "gso-motor-pool",
    "office_name": "GSO - MOTOR POOL",
    "address": "NTPM",
    "trunkline": ["7 119 5236"],
    "website": null,
    "email": ["motorpoolsection2023@gmail.com"],
    "department_head": {
      "name": "Mr. Ciarlino Payra",
      "contact": null,
      "email": null
    }
  },
  {
    "slug": "gso-solid-waste-management",
    "office_name": "GSO - SOLID WASTE MANAGEMENT",
    "address": "Floodway",
    "trunkline": ["(02) 8282 5737"],
    "website": null,
    "email": [null],
    "department_head": {
      "name": "Engr. Jess Tanap",
      "contact": null,
      "email": null
    }
  },
  {
    "slug": "health-office-central-supplies-office",
    "office_name": "HEALTH OFFICE - CENTRAL SUPPLIES OFFICE",
    "address": "Emergency Hospital",
    "trunkline": [null],
    "website": null,
    "email": ["centralsupplyofficeteh@gmail.com"],
    "department_head": {
      "name": "Dra. Mary Elinore B. Sta. Ana, M.D. (Dra. Boots)",
      "contact": null,
      "email": null
    }
  },
  {
    "slug": "health-office-epidemiology-and-surveillance-unite-mesu",
    "office_name": "HEALTH OFFICE - EPIDEMIOLOGY AND SURVEILLANCE UNITE (MESU)",
    "address": "Emergency Hospital",
    "trunkline": ["0998 595 1145", "0917 625 0065"],
    "website": null,